{"run_id":"01JBQ6Z3V8K4M2N5P7R9T1W3X4","created_at":"2026-10-29T12:00:00Z","brief_hash":"1111111111111111111111111111111111111111111111111111111111111111","mode":"deep_narrow","surface":"unknown","kernel":"present","kernel_version":"dev","model_map":{},"prompt_hashes":{},"config_hash":"2222222222222222222222222222222222222222222222222222222222222222","config_source":"embedded","schema_version":"2.0.0-alpha.1","playbook_hash":null,"gate_results":[],"usage":{"source":"estimated","calls":0},"wall_ms":0,"seed":0}
